{
  "code": "F203",
  "title": "Relational database design",
  "assessment": "nea",
  "summary": "Covers relational database concepts, then planning a database solution: user requirements, normalisation to 3NF, ERDs, data dictionaries, forms, queries, macros and outputs. It also covers building the database with software tools, testing it against a test plan, and evaluating both the finished solution and the planning process.",
  "flashcards": [
    {
      "id": "F203-FC01",
      "topicArea": 1,
      "front": "What is the difference between a relational and a non-relational database?",
      "back": "A relational database stores data in tables of records (rows) and fields (columns), linked by primary and foreign keys. It suits structured data such as bookings or orders. A non-relational database stores data without fixed tables, for example as documents, key-value pairs or graphs. It suits large volumes of unstructured or frequently changing data such as social media posts.",
      "keyTerms": [
        "relational database",
        "non-relational database"
      ]
    },
    {
      "id": "F203-FC02",
      "topicArea": 1,
      "front": "How do primary, foreign and composite keys differ?",
      "back": "A primary key is a field that uniquely identifies each record in a table, for example PetID. A foreign key is a field in one table that is the primary key of another table, and it creates the link between the two. A composite key is a primary key made by combining two or more fields, often used in a link table, for example PetID + VetID.",
      "keyTerms": [
        "primary key",
        "foreign key",
        "composite key"
      ]
    },
    {
      "id": "F203-FC03",
      "topicArea": 1,
      "front": "Why is referential integrity enforced on relationships between tables?",
      "back": "Referential integrity makes sure every foreign key value matches an existing primary key in the linked table. It stops orphan records, such as an appointment for a pet that does not exist. It also prevents a parent record from being deleted while linked child records still exist, and it can cascade updates or deletes so that linked data stays consistent and reliable.",
      "keyTerms": [
        "referential integrity",
        "foreign key",
        "orphan records"
      ]
    },
    {
      "id": "F203-FC04",
      "topicArea": 1,
      "front": "What is data redundancy and how can it be resolved?",
      "back": "Data redundancy is the unnecessary repetition of the same data in more than one place, for example an owner's address stored with every appointment. It wastes storage and causes inconsistencies when one copy is updated but the others are not. It is resolved by normalising the data into separate related tables, so each fact is stored once and linked using primary and foreign keys.",
      "keyTerms": [
        "data redundancy",
        "normalising"
      ]
    },
    {
      "id": "F203-FC05",
      "topicArea": 2,
      "front": "What does each stage of normalisation from 1NF to 3NF remove?",
      "back": "1NF removes repeating groups, so every field is atomic and each record has a primary key. 2NF must already be in 1NF and removes partial dependencies, so non-key fields depend on the whole of a composite key. 3NF must already be in 2NF and removes transitive dependencies, so non-key fields depend only on the key and not on another non-key field.",
      "keyTerms": [
        "1NF",
        "2NF",
        "3NF",
        "transitive dependencies"
      ]
    },
    {
      "id": "F203-FC06",
      "topicArea": 2,
      "front": "What is the purpose of a data dictionary and what does it contain?",
      "back": "A data dictionary records the planned structure of every table so that the database can be built accurately and consistently. For each field it records the field name, data type, field size, format, default value and whether the field is required (Y/N). It also records validation such as input masks or rules, which fields are primary keys, and the reference table for any foreign key.",
      "keyTerms": [
        "data dictionary",
        "field size",
        "input masks"
      ]
    },
    {
      "id": "F203-FC07",
      "topicArea": 2,
      "front": "How do functional and non-functional requirements affect database design?",
      "back": "Functional requirements state what the database must do. They include user needs, such as booking appointments or printing invoices, and security needs, such as passwords. They decide which tables, forms, queries and reports are needed. Non-functional requirements set constraints, such as performance, record retention, backup arrangements and development time. These affect archiving, storage and how much can realistically be built.",
      "keyTerms": [
        "functional requirements",
        "non-functional requirements",
        "record retention"
      ]
    },
    {
      "id": "F203-FC08",
      "topicArea": 3,
      "front": "Why might a developer create a form with a wizard and then edit it in design view?",
      "back": "A wizard quickly creates a basic working object, such as a form linked to the correct table or query, which saves time and avoids set-up errors. Design view is then used to improve it: applying house style, rearranging the layout, and adding labels, instructions, combo boxes, calculated fields and navigation buttons that the wizard does not provide.",
      "keyTerms": [
        "wizard",
        "design view",
        "house style"
      ]
    },
    {
      "id": "F203-FC09",
      "topicArea": 4,
      "front": "What is the difference between technical testing and usability testing of a database?",
      "back": "Technical testing checks that the database works correctly: validation rules, field sizes, data types, calculations, query results and the content of outputs. Usability testing checks that the solution is practical to use: that navigation features work and lead to the right place, and that forms and reports are clearly laid out. The developer carries out both, following a test plan.",
      "keyTerms": [
        "technical testing",
        "usability testing",
        "test plan"
      ]
    },
    {
      "id": "F203-FC10",
      "topicArea": 5,
      "front": "How does evaluating the database solution differ from evaluating the planning process?",
      "back": "Evaluating the solution judges the finished product. It asks how well the database meets the client's requirements and design intentions for layout, menus, interface, outputs and house style, and how efficient it is in terms of validation, lack of duplication and effective queries. Evaluating planning judges the process: how useful the requirements, ERD, normalisation, data dictionary and designs were, and what lessons learnt would change a similar future project.",
      "keyTerms": [
        "design intentions",
        "lessons learnt"
      ]
    }
  ],
  "questions": [
    {
      "id": "F203-Q01",
      "topicArea": 1,
      "commandWord": "Identify",
      "marks": 1,
      "context": "Harbourside Vets is building a relational database. Each owner can register several pets, but each pet is registered to only one owner.",
      "question": "Identify the type of relationship between the Owner table and the Pet table.",
      "markScheme": {
        "type": "points",
        "points": [
          "One-to-many (1)"
        ],
        "guidance": "Accept 1:M or 'one owner to many pets'. Do not accept one-to-one or many-to-many."
      },
      "modelAnswer": "One-to-many: one owner can have many pets, but each pet has only one owner."
    },
    {
      "id": "F203-Q02",
      "topicArea": 2,
      "commandWord": "Outline",
      "marks": 2,
      "context": "At Harbourside Vets, each pet can be treated by many vets and each vet treats many pets.",
      "question": "Outline how this many-to-many relationship should be resolved in the database design.",
      "markScheme": {
        "type": "points",
        "points": [
          "Create a new link (junction) table between Pet and Vet, e.g. Treatment (1)",
          "The link table holds PetID and VetID as foreign keys (1)",
          "This creates two one-to-many relationships, from Pet and from Vet to the link table (1)",
          "The foreign keys can be combined to form a composite primary key (1)"
        ],
        "guidance": "Award a maximum of 2 marks. The first mark is for the idea of a new link table."
      },
      "modelAnswer": "Create a new link table, such as Treatment, between Pet and Vet. It holds PetID and VetID as foreign keys, which replaces the many-to-many relationship with two one-to-many relationships."
    },
    {
      "id": "F203-Q03",
      "topicArea": 4,
      "commandWord": "Classify",
      "marks": 3,
      "context": "In the Harbourside Vets database, the Weight field in the Pet table has the validation rule Between 0.1 And 90 (kilograms).",
      "question": "Classify each of the following test data items as valid, invalid or extreme for the Weight field: 45, 90, -3.",
      "markScheme": {
        "type": "points",
        "points": [
          "45 is valid (1)",
          "90 is extreme (1)",
          "-3 is invalid (1)"
        ],
        "guidance": "Accept 'erroneous' for invalid. Accept 'boundary' for extreme. One mark for each correct classification."
      },
      "modelAnswer": "45 is valid, because it lies well inside the accepted range of 0.1 to 90 kg.\n90 is extreme, because it is on the upper boundary of the range and should still be accepted.\n-3 is invalid (erroneous), because it is outside the range and should be rejected with an error message."
    },
    {
      "id": "F203-Q04",
      "topicArea": 1,
      "commandWord": "Describe",
      "marks": 4,
      "context": "At Harbourside Vets, receptionists and vets update appointment and payment records at the same time from different computers.",